{
  "attributes": {
    "brim_version": "0.1",
    "SubTypeID": 0
  },
  "zarr_format": 3,
  "consolidated_metadata": {
    "kind": "inline",
    "must_understand": false,
    "metadata": {
      "Brillouin_data": {
        "attributes": {},
        "zarr_format": 3,
        "consolidated_metadata": {
          "kind": "inline",
          "must_understand": false,
          "metadata": {}
        },
        "node_type": "group"
      },
      "Brillouin_data/Data_0": {
        "attributes": {},
        "zarr_format": 3,
        "consolidated_metadata": {
          "kind": "inline",
          "must_understand": false,
          "metadata": {}
        },
        "node_type": "group"
      },
      "Brillouin_data/Metadata": {
        "attributes": {},
        "zarr_format": 3,
        "consolidated_metadata": {
          "kind": "inline",
          "must_understand": false,
          "metadata": {}
        },
        "node_type": "group"
      },
      "Brillouin_data/Data_0/Analysis_0": {
        "attributes": {
          "Fit_model": "Lorentzian"
        },
        "zarr_format": 3,
        "consolidated_metadata": {
          "kind": "inline",
          "must_understand": false,
          "metadata": {}
        },
        "node_type": "group"
      },
      "Brillouin_data/Data_0/Frequency": {
        "shape": [
          21513,
          96
        ],
        "data_type": "float64",
        "chunk_grid": {
          "name": "regular",
          "configuration": {
            "chunk_shape": [
              673,
              96
            ]
          }
        },
        "chunk_key_encoding": {
          "name": "default",
          "configuration": {
            "separator": "/"
          }
        },
        "fill_value": 0.0,
        "codecs": [
          {
            "name": "bytes",
            "configuration": {
              "endian": "little"
            }
          },
          {
            "name": "zstd",
            "configuration": {
              "level": 0,
              "checksum": false
            }
          }
        ],
        "attributes": {
          "Units": "GHz"
        },
        "zarr_format": 3,
        "node_type": "array",
        "storage_transformers": []
      },

      "Brillouin_data/Data_0/Scanning": {
        "attributes": {},
        "zarr_format": 3,
        "consolidated_metadata": {
          "kind": "inline",
          "must_understand": false,
          "metadata": {}
        },
        "node_type": "group"
      },
      "Brillouin_data/Metadata/Acquisition": {
        "attributes": {
          "Scanning_strategy": "point_scanning",
          "Acquisition_time": 180,
          "Acquisition_time_units": "ms"
        },
        "zarr_format": 3,
        "consolidated_metadata": {
          "kind": "inline",
          "must_understand": false,
          "metadata": {}
        },
        "node_type": "group"
      },
      "Brillouin_data/Metadata/Brillouin": {
        "attributes": {
          "Signal_type": "spontaneous",
          "Scattering_angle": 180.0,
          "Scattering_angle_units": "deg",
          "Phonons_measured": "longitudinal-like",
          "Polarization_probed_analyzed": "circular-circular",
          "Shift_precision": 10,
          "Shift_precision_units": "MHz"
        },
        "zarr_format": 3,
        "consolidated_metadata": {
          "kind": "inline",
          "must_understand": false,
          "metadata": {}
        },
        "node_type": "group"
      },
      "Brillouin_data/Metadata/Experiment": {
        "attributes": {
          "Datetime": "2020-01-16T00:00:00",
          "Temperature": 22.0,
          "Temperature_units": "C"
        },
        "zarr_format": 3,
        "consolidated_metadata": {
          "kind": "inline",
          "must_understand": false,
          "metadata": {}
        },
        "node_type": "group"
      },
      "Brillouin_data/Metadata/Optics": {
        "attributes": {
          "Wavelength": 532,
          "Wavelength_units": "nm",
          "Power": 10,
          "Power_units": "mW",
          "Lens_NA": 1.0,
          "Immersion_medium": "oil"
        },
        "zarr_format": 3,
        "consolidated_metadata": {
          "kind": "inline",
          "must_understand": false,
          "metadata": {}
        },
        "node_type": "group"
      },
      "Brillouin_data/Metadata/Spectrometer": {
        "attributes": {
          "Type": "VIPA",
          "Resolution": 0.46,
          "Resolution_units": "GHz",
          "Detector_type": "EMCCD",
          "Additional_filter": "Lyot"
        },
        "zarr_format": 3,
        "consolidated_metadata": {
          "kind": "inline",
          "must_understand": false,
          "metadata": {}
        },
        "node_type": "group"
      },
      "Brillouin_data/Data_0/Analysis_0/Amplitude_AS_0": {
        "shape": [
          21513
        ],
        "data_type": "float64",
        "chunk_grid": {
          "name": "regular",
          "configuration": {
            "chunk_shape": [
              21513
            ]
          }
        },
        "chunk_key_encoding": {
          "name": "default",
          "configuration": {
            "separator": "/"
          }
        },
        "fill_value": 0.0,
        "codecs": [
          {
            "name": "bytes",
            "configuration": {
              "endian": "little"
            }
          },
          {
            "name": "zstd",
            "configuration": {
              "level": 0,
              "checksum": false
            }
          }
        ],
        "attributes": {},
        "zarr_format": 3,
        "node_type": "array",
        "storage_transformers": []
      },
      "Brillouin_data/Data_0/Analysis_0/Amplitude_S_0": {
        "shape": [
          21513
        ],
        "data_type": "float64",
        "chunk_grid": {
          "name": "regular",
          "configuration": {
            "chunk_shape": [
              21513
            ]
          }
        },
        "chunk_key_encoding": {
          "name": "default",
          "configuration": {
            "separator": "/"
          }
        },
        "fill_value": 0.0,
        "codecs": [
          {
            "name": "bytes",
            "configuration": {
              "endian": "little"
            }
          },
          {
            "name": "zstd",
            "configuration": {
              "level": 0,
              "checksum": false
            }
          }
        ],
        "attributes": {},
        "zarr_format": 3,
        "node_type": "array",
        "storage_transformers": []
      },
      "Brillouin_data/Data_0/Analysis_0/Offset_AS_0": {
        "shape": [
          21513
        ],
        "data_type": "float64",
        "chunk_grid": {
          "name": "regular",
          "configuration": {
            "chunk_shape": [
              21513
            ]
          }
        },
        "chunk_key_encoding": {
          "name": "default",
          "configuration": {
            "separator": "/"
          }
        },
        "fill_value": 0.0,
        "codecs": [
          {
            "name": "bytes",
            "configuration": {
              "endian": "little"
            }
          },
          {
            "name": "zstd",
            "configuration": {
              "level": 0,
              "checksum": false
            }
          }
        ],
        "attributes": {},
        "zarr_format": 3,
        "node_type": "array",
        "storage_transformers": []
      },
      "Brillouin_data/Data_0/Analysis_0/Offset_S_0": {
        "shape": [
          21513
        ],
        "data_type": "float64",
        "chunk_grid": {
          "name": "regular",
          "configuration": {
            "chunk_shape": [
              21513
            ]
          }
        },
        "chunk_key_encoding": {
          "name": "default",
          "configuration": {
            "separator": "/"
          }
        },
        "fill_value": 0.0,
        "codecs": [
          {
            "name": "bytes",
            "configuration": {
              "endian": "little"
            }
          },
          {
            "name": "zstd",
            "configuration": {
              "level": 0,
              "checksum": false
            }
          }
        ],
        "attributes": {},
        "zarr_format": 3,
        "node_type": "array",
        "storage_transformers": []
      },
      "Brillouin_data/Data_0/Analysis_0/Shift_AS_0": {
        "shape": [
          21513
        ],
        "data_type": "float64",
        "chunk_grid": {
          "name": "regular",
          "configuration": {
            "chunk_shape": [
              21513
            ]
          }
        },
        "chunk_key_encoding": {
          "name": "default",
          "configuration": {
            "separator": "/"
          }
        },
        "fill_value": 0.0,
        "codecs": [
          {
            "name": "bytes",
            "configuration": {
              "endian": "little"
            }
          },
          {
            "name": "zstd",
            "configuration": {
              "level": 0,
              "checksum": false
            }
          }
        ],
        "attributes": {
          "Units": "GHz"
        },
        "zarr_format": 3,
        "node_type": "array",
        "storage_transformers": []
      },
      "Brillouin_data/Data_0/Analysis_0/Shift_S_0": {
        "shape": [
          21513
        ],
        "data_type": "float64",
        "chunk_grid": {
          "name": "regular",
          "configuration": {
            "chunk_shape": [
              21513
            ]
          }
        },
        "chunk_key_encoding": {
          "name": "default",
          "configuration": {
            "separator": "/"
          }
        },
        "fill_value": 0.0,
        "codecs": [
          {
            "name": "bytes",
            "configuration": {